{"plan_version_id":"tst:plan-version:referencecity-plan0001-v1","plan_artifact_id":"tst:plan:referencecity-plan0001","version":"1","content_digest":{"algorithm":"sha256","digest":"ad2760711d5cbd713b0f92340aa5d6158a42340dd4273ea9cb4e7bfeb4232f45","canonicalization":"RFC8785-JCS"},"created_at":"2030-01-01T00:00:00Z","effective_from":"2030-01-01T00:00:00Z","effective_until":"2030-03-02T01:00:00Z","status":"superseded","previous_version_ref":null,"evidence_refs":["RC:DOC:000001"],"schema_version":"0.4"}