{"plan_version_id":"tst:plan-version:referencecity-plan0001-v2","plan_artifact_id":"tst:plan:referencecity-plan0001","version":"2","content_digest":{"algorithm":"sha256","digest":"2222222222222222222222222222222222222222222222222222222222222222","canonicalization":"RFC8785-JCS"},"created_at":"2030-03-02T01:00:00Z","effective_from":null,"effective_until":null,"status":"draft","previous_version_ref":"tst:plan-version:referencecity-plan0001-v1","evidence_refs":[],"schema_version":"0.4"}